{
  "$schema": "https://json-schema.org/draft/2020-12/schema",
  "$id": "https://definitions.dimo.org/schema/template.schema.json",
  "title": "Template",
  "description": "A vehicle trim-configuration template: one model-year, plus the trims it shipped in. This is the object Console edits and R2 serves. Attributes true of every trim live on `attributes`; anything that differs between trims lives on that trim. A VIN decode narrows this template to exactly one trim and emits a Resolved document.",
  "type": "object",
  "required": [
    "id",
    "deviceType",
    "manufacturer",
    "model",
    "year",
    "attributes",
    "trims",
    "version",
    "createdAt",
    "updatedAt"
  ],
  "additionalProperties": false,
  "properties": {
    "id": {
      "type": "string",
      "pattern": "^[a-z0-9][a-z0-9._&+-]*_[a-z0-9._&+-]+_[0-9]{4}$",
      "description": "manufacturer-slug _ model-slug _ year. The only identifier. There is no ksuid, no legacy id, and no on-chain table backing this."
    },
    "deviceType": {
      "type": "string",
      "pattern": "^[a-z0-9_]+$",
      "description": "DeviceType id whose vocabulary this template is validated against."
    },
    "manufacturer": {
      "type": "object",
      "title": "TemplateManufacturer",
      "description": "Denormalised into the template on purpose: reading a template must not require a second lookup. The brand does not need on-chain STORAGE provisioned to have a template, but it does need a Manufacturer NFT -- see tokenId.",
      "required": ["slug", "name", "tokenId"],
      "additionalProperties": false,
      "properties": {
        "slug": {
          "type": "string",
          "pattern": "^[a-z0-9][a-z0-9._&+-]*$"
        },
        "name": {
          "type": "string",
          "minLength": 1
        },
        "tokenId": {
          "type": "integer",
          "minimum": 1,
          "description": "Manufacturer NFT. Required: identity-api keys every template it serves on this token (manufacturer.deviceDefinitions, and the chain check that decides whether a catalog is adopted at all), so a template without one is unservable there and, past a small fraction of the catalog, refuses the whole build. Every one of the 17,993 definitions in the production catalog carries one, so the producer can always supply it: a definition whose manufacturer cannot be resolved to a token id is dropped by the extraction, not emitted without it."
        }
      }
    },
    "model": {
      "type": "string",
      "minLength": 1
    },
    "year": {
      "type": "integer",
      "minimum": 1885,
      "maximum": 2100
    },
    "imageURI": {
      "type": "string",
      "format": "uri"
    },
    "hardwareTemplateId": {
      "type": "string",
      "pattern": "^[0-9]+$",
      "default": "130",
      "description": "Which DIMO hardware configuration this vehicle takes. NOT a vehicle attribute: it describes what our gear does with the car, not what the car is, so it sits outside `attributes` and is never validated against the DeviceType vocabulary. Template-level value is the default for every trim; a trim may override it. Today `common/utils.go:202` stamps \"130\" on every definition and exactly 3 style rows override it. Contribution-gated: an open contributor must not be able to change what hardware we ship."
    },
    "attributes": {
      "$ref": "#/$defs/attributeMap"
    },
    "trims": {
      "type": "array",
      "minItems": 1,
      "description": "At least one. A model-year sold in a single configuration has exactly one trim; that is still a trim, not a special case.",
      "items": {
        "$ref": "#/$defs/trim"
      }
    },
    "version": {
      "type": "integer",
      "minimum": 1,
      "description": "Increments on every published edit. Immutable once written: t/<id>/v/<version>.json is the permanent record."
    },
    "author": {
      "type": "string",
      "pattern": "^0x[0-9a-fA-F]{40}$",
      "description": "Address that published this version. Every edit is attributed."
    },
    "createdAt": {
      "type": "string",
      "format": "date-time"
    },
    "updatedAt": {
      "type": "string",
      "format": "date-time"
    }
  },
  "$defs": {
    "trim": {
      "type": "object",
      "title": "Trim",
      "required": ["name", "attributes"],
      "additionalProperties": false,
      "properties": {
        "name": {
          "type": "string",
          "minLength": 1,
          "description": "As the manufacturer markets it: \"XSE V6\", \"Hybrid LE\", \"Long Range AWD\"."
        },
        "selectors": {
          "$ref": "#/$defs/selectors",
          "description": "How a decoded VIN is matched to this trim. Omit on a single-trim template."
        },
        "hardwareTemplateId": {
          "type": "string",
          "pattern": "^[0-9]+$",
          "description": "Overrides the template's value for this trim only. Omit unless this trim genuinely takes different hardware."
        },
        "attributes": {
          "$ref": "#/$defs/attributeMap"
        }
      }
    },
    "selectors": {
      "type": "object",
      "title": "TrimSelectors",
      "description": "Signals from the VIN decoder. A trim matches when every selector present matches. Most specific match wins; ties are a template defect and must be reported, not silently broken.",
      "additionalProperties": false,
      "properties": {
        "manufacturerCode": {
          "type": "array",
          "items": {
            "type": "string",
            "pattern": "\\S"
          },
          "description": "OEM model/option code. Already present in today's data as manufacturer_code, where it sits on the model-year record doing nothing — it is a trim key that was flattened. Every entry must carry a non-whitespace character: the consumer compares it verbatim (dd-api's containsExact), so a blank entry matches no VIN that will ever exist, while the worker's own selector check reads a trim whose only entries are blank as having no selector at all — the two disagree, and the template is either refused with a message about the wrong thing or stored and silently unmatched. `minLength` is not the rule: the value that reached production was a single space."
        },
        "styleName": {
          "type": "array",
          "items": {
            "type": "string",
            "pattern": "\\S"
          },
          "description": "Style string as the upstream decoder reports it. Matched case-insensitively. Every entry must carry a non-whitespace character, for the reason given on manufacturerCode."
        },
        "vinPattern": {
          "type": "string",
          "format": "regex",
          "minLength": 1,
          "description": "Anchored regex over the 17-character VIN for OEMs that encode trim positionally. The consumer compiles it with Go's RE2 as ^(?:<pattern>)$ and fails safe to \"no match\" if it does not compile, so a pattern RE2 cannot take is indistinguishable from one that matches no VIN. Writes are validated against that: the wrapped form must compile, and lookarounds ((?=, (?!, (?<=, (?<!) and backreferences (\\1, \\k<name>) are refused outright -- JavaScript accepts all of them and RE2 supports none."
        }
      }
    },
    "attributeMap": {
      "type": "object",
      "title": "AttributeMap",
      "description": "name -> value. On the template these are the attributes shared by every trim; on a trim they are that trim's own. An attribute is either on the template or on a trim, never both. Names must exist in the DeviceType; enum values must appear in that attribute's options. An attribute that is unknown is ABSENT — never \"\" and never \"<nil>\". 6% of today's attribute rows are one of those two placeholders; this schema makes them unrepresentable.",
      "propertyNames": {
        "pattern": "^[a-z0-9_]+$"
      },
      "additionalProperties": {
        "type": ["string", "number", "integer", "boolean"],
        "description": "Typed, not stringified. fuel_tank_capacity_gal is 15.8, not \"15.800000\"."
      }
    }
  }
}
