{
  "id": "toyota_camry_2020",
  "deviceType": "vehicle",
  "manufacturer": {
    "slug": "toyota",
    "name": "Toyota",
    "tokenId": 131
  },
  "model": "Camry",
  "year": 2020,
  "hardwareTemplateId": "130",
  "attributes": {
    "number_of_doors": 4,
    "vehicle_type": "sedan",
    "wheelbase_in": 111
  },
  "trims": [
    {
      "name": "LE",
      "selectors": {
        "manufacturerCode": ["2532"]
      },
      "attributes": {
        "powertrain_type": "ICE",
        "fuel_type": "gasoline",
        "driven_wheels": "FWD",
        "fuel_tank_capacity_gal": 16,
        "mpg_city": 28,
        "mpg_highway": 39,
        "mpg_combined": 32,
        "base_msrp": 24970
      }
    },
    {
      "name": "SE",
      "selectors": {
        "manufacturerCode": ["2546"]
      },
      "attributes": {
        "powertrain_type": "ICE",
        "fuel_type": "gasoline",
        "driven_wheels": "FWD",
        "fuel_tank_capacity_gal": 16,
        "base_msrp": 26170
      }
    },
    {
      "name": "SE Nightshade",
      "selectors": {
        "manufacturerCode": ["2536"]
      },
      "attributes": {
        "powertrain_type": "ICE",
        "fuel_type": "gasoline",
        "driven_wheels": "FWD",
        "fuel_tank_capacity_gal": 16
      }
    },
    {
      "name": "XLE",
      "selectors": {
        "manufacturerCode": ["2517"]
      },
      "attributes": {
        "powertrain_type": "ICE",
        "fuel_type": "gasoline",
        "driven_wheels": "AWD",
        "fuel_tank_capacity_gal": 16,
        "base_msrp": 30855
      }
    },
    {
      "name": "XSE",
      "selectors": {
        "manufacturerCode": ["2548"]
      },
      "attributes": {
        "powertrain_type": "ICE",
        "fuel_type": "gasoline",
        "driven_wheels": "FWD",
        "fuel_tank_capacity_gal": 16,
        "mpg_city": 27,
        "mpg_highway": 38,
        "mpg_combined": 31,
        "base_msrp": 30005
      }
    },
    {
      "name": "TRD V6",
      "selectors": {
        "manufacturerCode": ["2549"]
      },
      "attributes": {
        "powertrain_type": "ICE",
        "fuel_type": "gasoline",
        "driven_wheels": "FWD",
        "fuel_tank_capacity_gal": 16
      }
    },
    {
      "name": "XSE V6",
      "selectors": {
        "manufacturerCode": ["2550"]
      },
      "attributes": {
        "powertrain_type": "ICE",
        "fuel_type": "gasoline",
        "driven_wheels": "FWD",
        "fuel_tank_capacity_gal": 16,
        "base_msrp": 35130
      }
    },
    {
      "name": "Hybrid LE",
      "selectors": {
        "manufacturerCode": ["2559"]
      },
      "attributes": {
        "powertrain_type": "HEV",
        "fuel_type": "gasoline",
        "driven_wheels": "FWD",
        "fuel_tank_capacity_gal": 13.2,
        "base_msrp": 28430
      }
    },
    {
      "name": "Hybrid SE",
      "selectors": {
        "manufacturerCode": ["2561"]
      },
      "attributes": {
        "powertrain_type": "HEV",
        "fuel_type": "gasoline",
        "driven_wheels": "FWD",
        "fuel_tank_capacity_gal": 13.2,
        "base_msrp": 30130
      }
    },
    {
      "name": "Hybrid XLE",
      "selectors": {
        "manufacturerCode": ["2560"]
      },
      "attributes": {
        "powertrain_type": "HEV",
        "fuel_type": "gasoline",
        "driven_wheels": "FWD",
        "fuel_tank_capacity_gal": 13.2,
        "mpg_city": 44,
        "mpg_highway": 47,
        "mpg_combined": 46,
        "base_msrp": 32730
      }
    }
  ],
  "version": 1,
  "author": "0x0000000000000000000000000000000000000000",
  "createdAt": "2026-08-26T00:00:00.000Z",
  "updatedAt": "2026-08-26T00:00:00.000Z"
}
